{
  "schema_version": "1.0.0",
  "project_id": "project_rgbt_cuda_001",
  "protocol_id": "research_protocol_rgbt_dfine_formal_c1_v1",
  "protocol_version": 1,
  "title": "Formal C1: early_concat vs DFINE rgb+none APS under matched Frozen Fingerprint",
  "goal": {
    "improve": "small_object_detection",
    "task_type": "rgbt_detection",
    "notes": "Human Gate started (user said 开始). Formal budget only. Probe protocol research_protocol_rgbt_dfine_v1 remains allow_scientific_claims=false. early_concat is existing staging blend, not FDPN."
  },
  "baseline": {
    "model": "DFINE-S",
    "dataset": "dataset:rgbt_tiny_v1",
    "adapter": "dfine",
    "reference_run_id": "run_plan_formal_01_rgb_none"
  },
  "objective": {
    "primary": { "metric": "APS", "direction": "maximize" },
    "secondary": [
      { "metric": "mAP50_95", "direction": "maximize" },
      { "metric": "mAP50", "direction": "maximize" }
    ]
  },
  "editable_scope": [
    "fusion",
    "neck",
    "loss",
    "optimizer",
    "hyperparameter",
    "augmentation"
  ],
  "frozen_scope": [
    "dataset_split",
    "evaluator",
    "metric_definition",
    "baseline_result",
    "gate_rule",
    "human_permission_policy"
  ],
  "constraints": {
    "params_m": { "max": 20 },
    "flops_g": { "max": 65 },
    "gpu_memory_gb": { "max": 24 },
    "max_runtime": "4h"
  },
  "experiment_budget": {
    "probe": "10min",
    "validation": "60min",
    "formal": "4h"
  },
  "risk_policy": {
    "probe_training": "auto",
    "full_training": "auto",
    "install_dependency": "approval_required",
    "dataset_change": "forbidden",
    "evaluator_change": "forbidden",
    "code_outside_editable": "forbidden"
  },
  "decision_policy": {
    "keep_requires": { "primary_not_worse_than": -0.1 },
    "validate_if": { "primary_gain_at_least": 0.5 },
    "discard_if": { "primary_worse_than": -0.5 }
  },
  "stop_rules": {
    "max_rounds": 2,
    "max_consecutive_discards": 3,
    "max_execution_failures": 2,
    "stop_if_no_improvement_for": 2,
    "max_duplicate_plan_rejects": 3
  },
  "fingerprint_id": "FP-RGBT-DFINE-FORMAL-C1-V1",
  "claim_policy": {
    "allow_scientific_claims": true,
    "allow_significance_claim": false,
    "allow_sota_claim": false,
    "default_claim_level": "exploratory_comparison",
    "claim_types": ["observational", "comparative"],
    "max_claim_strength": "C1"
  },
    "notes": "full_training=auto encodes Human Gate for this formal C1 pair only. Minimum formal: execution_mode=full_train (no 16/8 subset), full val, APS metric spec, epochs=2, 160x160, pretrained=true, scale_queries_to_tokens=true (160 cannot hold 300 queries), timeout=4h/run. Not 640/20ep paper protocol. Probe still cannot support C1+."
}
